{
  "$schema": "https://json-schema.org/draft/2020-12/schema",
  "$id": "urn:mosaic:protocol:schema:commerce-provider:v2:compatibility-manifest",
  "title": "Mosaic Commerce Provider v2 Compatibility Manifest",
  "type": "object",
  "additionalProperties": false,
  "required": [
    "commerceProviderContractVersion",
    "status",
    "schema",
    "canonicalFixtures",
    "recordTypes",
    "readerPolicy"
  ],
  "properties": {
    "commerceProviderContractVersion": {
      "const": "2"
    },
    "status": {
      "type": "string",
      "enum": [
        "draft",
        "releaseCandidate",
        "approved",
        "deprecated",
        "retired"
      ]
    },
    "deprecation": {
      "type": "object",
      "description": "Lifecycle metadata present only once this contract version enters the deprecated or retired state. Absent for draft, releaseCandidate, and approved contracts. See docs/protocol/deprecation-policy.md.",
      "additionalProperties": false,
      "required": [
        "deprecatedAt",
        "retiresAt"
      ],
      "properties": {
        "deprecatedAt": {
          "type": "string",
          "pattern": "^[0-9]{4}-(0[1-9]|1[0-2])-([0-2][0-9]|3[01])$",
          "description": "UTC calendar date on which this contract version was deprecated."
        },
        "retiresAt": {
          "type": "string",
          "pattern": "^[0-9]{4}-(0[1-9]|1[0-2])-([0-2][0-9]|3[01])$",
          "description": "Earliest UTC calendar date on which this contract version may be retired."
        },
        "supersededBy": {
          "type": "string",
          "minLength": 1,
          "maxLength": 128,
          "description": "Identifier of the approved successor contract version, when one exists."
        },
        "migrationGuide": {
          "type": "string",
          "minLength": 1,
          "maxLength": 256,
          "description": "Repository-relative path to the migration guide for the successor version."
        }
      }
    },
    "schema": {
      "type": "string",
      "minLength": 1
    },
    "canonicalFixtures": {
      "type": "array",
      "minItems": 1,
      "maxItems": 16,
      "uniqueItems": true,
      "items": {
        "type": "string",
        "minLength": 1
      }
    },
    "recordTypes": {
      "type": "array",
      "minItems": 10,
      "maxItems": 10,
      "uniqueItems": true,
      "items": {
        "type": "string",
        "enum": [
          "providerProfile",
          "productLoadRequest",
          "productLoadResult",
          "purchaseRequest",
          "purchaseOutcome",
          "restoreOutcome",
          "activeEntitlementOutcome",
          "providerDiagnostics",
          "commerceUpdate",
          "commerceUpdateAcceptance"
        ]
      }
    },
    "readerPolicy": {
      "type": "object",
      "additionalProperties": false,
      "required": [
        "unknownContractVersion",
        "unknownRecordType",
        "unknownField",
        "unknownOutcome",
        "unsupportedCapability",
        "unavailableProduct",
        "entitlementLookupFailure",
        "rawProviderError"
      ],
      "properties": {
        "unknownContractVersion": {
          "const": "rejectRecord"
        },
        "unknownRecordType": {
          "const": "rejectRecord"
        },
        "unknownField": {
          "const": "rejectRecord"
        },
        "unknownOutcome": {
          "const": "rejectRecord"
        },
        "unsupportedCapability": {
          "const": "reportUnsupportedWithoutProviderFailure"
        },
        "unavailableProduct": {
          "const": "usePaywallProductFallback"
        },
        "entitlementLookupFailure": {
          "const": "neverInferInactive"
        },
        "rawProviderError": {
          "const": "forbidden"
        }
      }
    }
  }
}
